10,2021-02-11 14:50:28.200721,2021-02-11 14:50:28.200752,https://github.com/OpenUnited/product-factory/issues/7,Take a picture,Description for task: Take a picture,0,1,2,1,2,39211d40-9fcc-4a2f-9bb5-5f182f1fa0a1,,"",false,false
11,2021-02-11 14:50:28.208400,2021-02-11 14:50:28.208438,https://github.com/OpenUnited/product-factory/issues/8,Take a video,Description for task: Take a video,0,1,3,1,3,d2bd14a9-a625-45de-b20f-27d45f482e08,,"",false,false
12,2021-02-11 14:50:28.215193,2021-02-11 14:50:28.215222,https://github.com/OpenUnited/product-factory/issues/4,Select an existing media from the phone gallery,Description for task: Select an existing media from the phone gallery,0,1,4,1,4,94531be4-d5aa-489e-b745-01ffb2a31209,,"",false,false
13,2021-02-11 14:50:28.222656,2021-02-11 14:50:28.222684,https://github.com/OpenUnited/product-factory/issues/7,Apply a filter,Description for task: Apply a filter,0,1,2,1,2,5c6b1009-f0be-4f0b-aa38-d4edbe6c4e94,,"",false,false
14,2021-02-11 14:50:28.228989,2021-02-11 14:50:28.229015,https://github.com/OpenUnited/product-factory/issues/8,Trim a video,Description for task: Trim a video,0,1,3,1,3,76084f63-befd-43ed-b053-95b5a9080d46,,"",false,false
15,2021-02-11 14:50:28.235765,2021-02-11 14:50:28.235793,https://github.com/OpenUnited/product-factory/issues/4,Take a picture,Description for task: Take a picture,0,1,4,1,4,06569c0a-972b-403f-8a67-6b7d47d64017,,"",false,false
16,2021-02-11 14:50:28.243931,2021-02-11 14:50:28.243961,https://github.com/OpenUnited/product-factory/issues/7,Crop an image,Description for task: Crop an image,0,1,2,1,2,668f0f6e-ff63-41b1-a6b1-07f53f894190,,"",false,false
17,2021-02-11 14:50:28.252514,2021-02-11 14:50:28.252543,https://github.com/OpenUnited/product-factory/issues/8,Select a cover for the video,Description for task: Select a cover for the video,0,1,3,1,3,264a718b-3615-426d-99e5-e90b276c17ee,,"",false,false
18,2021-02-11 14:50:28.259940,2021-02-11 14:50:28.259970,,Write a caption,Description for task: Tag people,0,1,4,1,4,9e7bfb27-676f-465c-85e1-8c89583f18c2,,"",false,false
